{
  "contract": "ujh.generate_proposal.v1",
  "run_id": "01920000-0000-7000-8000-00000000p002",
  "requested_at": "2026-10-02T16:20:00Z",
  "callback": {
    "url": "https://command.example.com/api/integrations/n8n/callback",
    "token": "rt_synthetic_fixture_token_proposal_002"
  },
  "job": {
    "id": "01920000-0000-7000-8000-00000000j001",
    "title": "Synthetic: extend a Next.js admin dashboard",
    "job_category": "NEXTJS_REACT",
    "budget_type": "fixed",
    "budget_min": 3000,
    "budget_max": 5000,
    "hourly_min": null,
    "hourly_max": null,
    "connect_cost": 16
  },
  "listing": {
    "id": "01920000-0000-7000-8000-00000000l001",
    "text": "SYNTHETIC FIXTURE LISTING. We run an internal Next.js admin dashboard backed by PostgreSQL and need a senior engineer to add role-based reporting pages, fix slow queries, and write tests. Fixed budget between 3000 and 5000 USD. Payment verified, 18 previous hires."
  },
  "analysis": {
    "id": "01920000-0000-7000-8000-00000000n001",
    "client_problem": "The internal team cannot keep up with reporting requests.",
    "recommended_positioning": "Senior engineer who can extend an existing codebase safely.",
    "why_candidate_matches": ["Production Next.js and PostgreSQL work"],
    "positive_signals": ["Verified payment", "Repeat hiring history"],
    "red_flags": ["Scope of legacy code unknown"],
    "missing_information": ["Next.js version"],
    "analysis_summary": "Solid fit with a reliable client and moderate competition."
  },
  "base_version": {
    "number": 1,
    "body": "Synthetic previous draft. Your team needs reporting pages without slowing down the rest of the roadmap. I have extended several Next.js and PostgreSQL dashboards in production and can start with the slowest queries before adding the new role-based pages."
  },
  "instructions": "Shorter opening, and mention query performance first."
}
